{
  "version": "2026-10-30",
  "source": "European Commission TEDB",
  "publisher": {
    "name": "vatnode.dev",
    "url": "https://vatnode.dev"
  },
  "rates": {
    "AD": {
      "country": "Andorra",
      "currency": "EUR",
      "eu_member": false,
      "vat_name": "Impost General Indirecte",
      "vat_abbr": "IGI",
      "standard": 4.5,
      "reduced": [
        1.0,
        2.5
      ],
      "super_reduced": null,
      "parking": null,
      "format": "1 letter + 6 digits + 1 letter",
      "pattern": "^[A-Z]\\d{6}[A-Z]$",
      "identifiers": {
        "registry_authority_name": {
          "ca": "Departament de Registres Jurídics i Econòmics",
          "en": "Department of Legal and Economic Registers"
        },
        "registry_name": {
          "ca": "Registre de Societats Mercantils",
          "en": "Register of Commercial Companies"
        },
        "registry_code_name": null,
        "tax_id_name": {
          "ca": "número de registre tributari",
          "en": "tax registration number"
        },
        "vat_id_name": {
          "ca": "número de registre tributari",
          "en": "tax registration number"
        }
      }
    },
    "AL": {
      "country": "Albania",
      "currency": "ALL",
      "eu_member": false,
      "vat_name": "Tatimi mbi vlerën e shtuar",
      "vat_abbr": "TVSH",
      "standard": 20.0,
      "reduced": [
        6.0,
        10.0
      ],
      "super_reduced": null,
      "parking": null,
      "format": "1 letter + 8 digits + 1 letter",
      "pattern": "^[A-Z]\\d{8}[A-Z]$",
      "identifiers": {
        "registry_authority_name": {
          "sq": "Qendra Kombëtare e Biznesit",
          "en": "National Business Center"
        },
        "registry_name": {
          "sq": "Regjistri Tregtar",
          "en": "Commercial Register"
        },
        "registry_code_name": {
          "sq": "NIPT",
          "en": "taxpayer identification number"
        },
        "tax_id_name": {
          "sq": "NIPT",
          "en": "taxpayer identification number"
        },
        "vat_id_name": null
      }
    },
    "AT": {
      "country": "Austria",
      "currency": "EUR",
      "eu_member": true,
      "vat_name": "Umsatzsteuer",
      "vat_abbr": "USt",
      "standard": 20.0,
      "reduced": [
        10.0,
        13.0,
        19.0
      ],
      "super_reduced": 4.9,
      "parking": null,
      "format": "ATU + 8 digits",
      "pattern": "^ATU\\d{8}$",
      "identifiers": {
        "registry_authority_name": {
          "de": "Landesgericht",
          "en": "regional court"
        },
        "registry_name": {
          "de": "Firmenbuch",
          "en": "company register"
        },
        "registry_code_name": {
          "de": "Firmenbuchnummer",
          "en": "company register number"
        },
        "tax_id_name": {
          "de": "Steuernummer",
          "en": "tax number"
        },
        "vat_id_name": {
          "de": "Umsatzsteuer-Identifikationsnummer",
          "en": "VAT identification number"
        }
      }
    },
    "BA": {
      "country": "Bosnia and Herzegovina",
      "currency": "BAM",
      "eu_member": false,
      "vat_name": "Porez na dodanu vrijednost",
      "vat_abbr": "PDV",
      "standard": 17.0,
      "reduced": [],
      "super_reduced": null,
      "parking": null,
      "format": "12 digits",
      "pattern": "^\\d{12}$",
      "identifiers": {
        "registry_authority_name": {
          "hr": "registarski sud",
          "en": "registration court"
        },
        "registry_name": {
          "hr": "sudski registar poslovnih subjekata",
          "en": "court register of business entities"
        },
        "registry_code_name": {
          "hr": "matični broj subjekta upisa",
          "en": "registration number of the registered entity"
        },
        "tax_id_name": {
          "bs": "jedinstveni identifikacioni broj",
          "en": "unique identification number"
        },
        "vat_id_name": {
          "bs": "identifikacioni broj obveznika indirektnih poreza",
          "en": "indirect taxpayer identification number"
        }
      }
    },
    "BE": {
      "country": "Belgium",
      "currency": "EUR",
      "eu_member": true,
      "vat_name": "Belasting over de toegevoegde waarde",
      "vat_abbr": "BTW",
      "standard": 21.0,
      "reduced": [
        6.0,
        12.0
      ],
      "super_reduced": null,
      "parking": 12.0,
      "format": "BE + 0/1 + 9 digits",
      "pattern": "^BE[01]\\d{9}$",
      "identifiers": {
        "registry_authority_name": {
          "nl": "FOD Economie",
          "fr": "SPF Economie",
          "de": "FÖD Wirtschaft",
          "en": "FPS Economy"
        },
        "registry_name": {
          "nl": "Kruispuntbank van Ondernemingen",
          "fr": "Banque-Carrefour des Entreprises",
          "de": "Zentrale Datenbank der Unternehmen",
          "en": "Crossroads Bank for Enterprises"
        },
        "registry_code_name": {
          "nl": "ondernemingsnummer",
          "fr": "numéro d'entreprise",
          "de": "Unternehmensnummer",
          "en": "enterprise number"
        },
        "tax_id_name": {
          "nl": "ondernemingsnummer",
          "fr": "numéro d'entreprise",
          "de": "Unternehmensnummer",
          "en": "enterprise number"
        },
        "vat_id_name": {
          "nl": "btw-nummer",
          "fr": "numéro de TVA",
          "de": "MwSt.-Nummer",
          "en": "VAT number"
        }
      }
    },
    "BG": {
      "country": "Bulgaria",
      "currency": "EUR",
      "eu_member": true,
      "vat_name": "Данък върху добавената стойност",
      "vat_abbr": "ДДС",
      "standard": 20.0,
      "reduced": [
        9.0
      ],
      "super_reduced": null,
      "parking": null,
      "format": "BG + 9–10 digits",
      "pattern": "^BG\\d{9,10}$",
      "identifiers": {
        "registry_authority_name": {
          "bg": "Агенция по вписванията",
          "en": "Registry Agency"
        },
        "registry_name": {
          "bg": "Търговски регистър и регистър на юридическите лица с нестопанска цел",
          "en": "Commercial Register and Register of Non-Profit Legal Entities"
        },
        "registry_code_name": {
          "bg": "единен идентификационен код",
          "en": "unified identification code"
        },
        "tax_id_name": null,
        "vat_id_name": {
          "bg": "идентификационен номер за целите на ДДС",
          "en": "VAT identification number"
        }
      }
    },
    "CH": {
      "country": "Switzerland",
      "currency": "CHF",
      "eu_member": false,
      "vat_name": "Mehrwertsteuer",
      "vat_abbr": "MWST",
      "standard": 8.1,
      "reduced": [
        2.6,
        3.8
      ],
      "super_reduced": null,
      "parking": null,
      "format": "CHE-NNN.NNN.NNN (+ MWST/TVA/IVA)",
      "pattern": "^CHE-?\\d{3}\\.?\\d{3}\\.?\\d{3}[ ]?(MWST|TVA|IVA)?$",
      "identifiers": {
        "registry_authority_name": {
          "de": "Eidgenössisches Amt für das Handelsregister",
          "fr": "Office fédéral du registre du commerce",
          "en": "Federal Commercial Registry Office"
        },
        "registry_name": {
          "de": "Handelsregister",
          "fr": "registre du commerce",
          "it": "registro di commercio",
          "en": "commercial register"
        },
        "registry_code_name": {
          "de": "Unternehmens-Identifikationsnummer",
          "fr": "numéro d'identification des entreprises",
          "it": "numero d'identificazione delle imprese",
          "en": "Unique Enterprise Identification Number"
        },
        "tax_id_name": {
          "de": "Unternehmens-Identifikationsnummer",
          "fr": "numéro d'identification des entreprises",
          "it": "numero d'identificazione delle imprese",
          "en": "Unique Enterprise Identification Number"
        },
        "vat_id_name": {
          "de": "MWST-Nummer",
          "fr": "numéro TVA",
          "en": "VAT number"
        }
      }
    },
    "CY": {
      "country": "Cyprus",
      "currency": "EUR",
      "eu_member": true,
      "vat_name": "Φόρος Προστιθέμενης Αξίας",
      "vat_abbr": "ΦΠΑ",
      "standard": 19.0,
      "reduced": [
        5.0,
        9.0
      ],
      "super_reduced": 3.0,
      "parking": null,
      "format": "CY + 8 digits + 1 letter",
      "pattern": "^CY\\d{8}[A-Z]$",
      "identifiers": {
        "registry_authority_name": {
          "el": "Τμήμα Εφόρου Εταιρειών και Διανοητικής Ιδιοκτησίας",
          "en": "Department of Registrar of Companies and Intellectual Property"
        },
        "registry_name": {
          "el": "Μητρώο Επιχειρηματικών Οντοτήτων",
          "en": "Business Register"
        },
        "registry_code_name": {
          "el": "αριθμός εγγραφής",
          "en": "registration number"
        },
        "tax_id_name": {
          "el": "Αριθμός Φορολογικής Ταυτότητας",
          "en": "Tax Identification Number"
        },
        "vat_id_name": null
      }
    },
    "CZ": {
      "country": "Czech Republic",
      "currency": "CZK",
      "eu_member": true,
      "vat_name": "Daň z přidané hodnoty",
      "vat_abbr": "DPH",
      "standard": 21.0,
      "reduced": [
        12.0
      ],
      "super_reduced": null,
      "parking": null,
      "format": "CZ + 8–10 digits",
      "pattern": "^CZ\\d{8,10}$",
      "identifiers": {
        "registry_authority_name": {
          "cs": "rejstříkový soud",
          "en": "registry court"
        },
        "registry_name": {
          "cs": "obchodní rejstřík",
          "en": "Commercial Register"
        },
        "registry_code_name": {
          "cs": "identifikační číslo",
          "en": "identification number"
        },
        "tax_id_name": {
          "cs": "daňové identifikační číslo",
          "en": "tax identification number"
        },
        "vat_id_name": {